{
  "$schema": "http://json-schema.org/draft-07/schema#",
  "$id": "https://openclaw.dev/schemas/openclaw.task.schema.json",
  "title": "TaskPacket",
  "type": "object",
  "additionalProperties": false,
  "required": ["task_id", "goal", "constraints", "success_criteria"],
  "properties": {
    "task_id": { "type": "string", "minLength": 1 },
    "priority": { "type": "string", "enum": ["low", "medium", "high"] },
    "goal": { "type": "string", "minLength": 1 },
    "context": { "type": "object", "additionalProperties": true },
    "constraints": { "type": "object", "additionalProperties": true },
    "success_criteria": {
      "type": "array",
      "minItems": 1,
      "items": { "type": "string", "minLength": 1 }
    },
    "costing": {
      "type": "object",
      "additionalProperties": false,
      "properties": {
        "cost_class": { "type": "string", "enum": ["light", "medium", "heavy"] }
      }
    }
  }
}
